Tool_Name,Price,Features,Pros,Cons,Verdict,Affiliate_Link
"Surfer SEO","$59/mo","","Data-driven content recommendations; Easy integration; Great for on-page SEO","Limited to content optimization; Requires other tools for full SEO","Top choice for content-focused SEO enhancement.","https://surferseo.com","Content optimization tool that uses SERP analysis to provide data-driven recommendations for improving on-page SEO.","Surfer SEO focuses on content optimization by analyzing top-ranking pages to suggest improvements for on-page elements like keyword density, content length, and structure. It integrates with tools like Google Docs and WordPress, making it easy to implement changes. The tool is highly effective for creating SEO-friendly content that ranks well, thanks to its data-driven approach. However, it is primarily a content tool and lacks broader SEO features like backlink analysis or rank tracking. Surfer SEO is best used in conjunction with other SEO tools for a comprehensive strategy, ideal for content creators and marketers aiming to boost their search visibility."
"Frase","$44.99/mo","","AI-driven research; Time-saving for content creation; Good for SEO content","Limited to content tasks; AI may lack nuance","Ideal for content creators seeking AI-assisted SEO optimization.","https://frase.io","AI-powered content research and optimization tool that helps create SEO-friendly articles by analyzing top search results.","Frase leverages artificial intelligence to assist with content research and optimization, making it easier to produce articles that meet SEO standards. It analyzes SERPs to provide insights on topics, questions, and keywords, then helps structure content accordingly. The tool is efficient for speeding up the content creation process and ensuring relevance to search intent. On the downside, it is more focused on content than broader SEO tasks, and the AI suggestions might not always capture nuanced human creativity. Frase is excellent for bloggers, writers, and marketers who want to streamline their content workflow while improving SEO performance."
"Clearscope","$170/mo","","Precise AI recommendations; Great for competitive content; High data accuracy","Expensive; Focused only on content","Best for large businesses needing advanced content optimization.","https://clearscope.io","Advanced content optimization platform that uses AI to provide detailed recommendations for improving search rankings.","Clearscope is a premium content optimization tool that uses AI and data analysis to offer precise recommendations for enhancing on-page SEO. It evaluates content against top competitors and suggests improvements based on relevance and comprehensiveness. The tool is highly effective for creating high-quality, rank-worthy content, especially for competitive keywords. However, its high price point makes it less accessible for small businesses, and it is specialized for content rather than overall SEO. Clearscope is best suited for enterprises and serious content marketers who prioritize data accuracy and are willing to invest in top-tier optimization tools."
"Scalenut","$39/mo","","Affordable AI tools; Good for content and keyword research; User-friendly","Less advanced AI; Limited broader SEO features","Great for SMBs wanting AI-enhanced SEO and content tools.","https://scalenut.com","AI-based SEO and content marketing platform that helps with keyword research, content creation, and optimization.","Scalenut combines AI technology with SEO tools to assist users in keyword research, content ideation, and optimization. It offers features like a content assistant for writing and a keyword planner for research, making it a versatile option for content marketers. The tool is affordable and user-friendly, suitable for small to medium businesses. However, its AI capabilities might not be as advanced as some higher-priced alternatives, and it may lack depth in areas like backlink analysis. Scalenut is a good all-rounder for those looking to integrate AI into their SEO and content strategies without a significant financial commitment."
"MarketMuse","$149/mo","","Strong AI for content strategy; Good for topic coverage; Data-driven insights","High cost; May be complex for small users","Optimal for large-scale content strategy and SEO planning.","https://marketmuse.com","AI-powered content strategy and optimization platform that uses data to plan and improve content for better SEO results.","MarketMuse utilizes AI to help with content strategy and optimization, focusing on topic coverage and relevance to improve search rankings. It provides insights into content gaps and opportunities, making it valuable for planning comprehensive content campaigns. The tool is robust and data-driven, ideal for enterprises and agencies looking to scale their content efforts. However, it is on the pricier side and may be overkill for small projects or beginners. MarketMuse excels in strategic content planning and is best used by teams that need to align content with SEO goals on a large scale."