Tool_Name,Price,Features,Pros,Cons,Verdict,Affiliate_Link
Mangools,$49.90,Keyword Research;SERP Watcher;Link Miner,Great UI;Cheaper;All-in-one,Limited Backlink Data,Best for Freelancers,https://mangools.com#tracker
Ahrefs,$99,Site Audit;Rank Tracker;Content Explorer,Massive Data;Industry Standard,Expensive;Credit Limits,Best for Pros,https://ahrefs.com
SEMrush,$129.95,SEO;PPC;Content;Social Media,Huge Feature Set;Reporting,Steep Learning Curve;Pricey,Best for Agencies,https://semrush.com
Ubersuggest,$29,Keyword Ideas;Site Audit,Very Cheap;Easy to use,Data often inaccurate,Best for Beginners,https://neilpatel.com/ubersuggest
Moz Pro,$99,Link Explorer;Keyword Explorer,Metric Authority (DA/PA),Outdated UI;Slow updates,Good for metrics,https://moz.com
"Tool_Name","Price","Features","Pros","Cons","Verdict","Affiliate_Link"
"Surfer SEO","$59/mo","Content Editor with real-time optimization; SERP Analyzer for competitor insights; Keyword Research with volume and difficulty scores","Makes on-page SEO actionable with data-driven recommendations.","Can be overwhelming for beginners due to its depth.","Best for content creators and SEO specialists focused on organic growth.","https://surferseo.com"
"Frase","$14.99/mo","AI Content Writer for SEO-optimized articles; Content Briefs from SERP analysis; Answer Engine for FAQ generation","Streamlines research and writing into one efficient workflow.","AI-generated content may require heavy editing for quality.","Best for small businesses and solo marketers needing quick, optimized content.","https://www.frase.io"
"Clearscope","$170/mo","Content Optimization with grade-based scoring; Competitor Analysis for top SERP pages; Integration with CMS like WordPress","Delivers precise, data-backed suggestions to improve content relevance.","Higher price point may deter budget-conscious users.","Best for enterprise teams and serious content marketers.","https://www.clearscope.io"
"Scalenut","$39/mo","AI-Powered SEO Reports; Cruise Mode for automated content creation; Topic Clusters for content strategy","Offers an all-in-one platform from research to publishing.","AI outputs can lack nuance for complex topics.","Best for startups and growth hackers scaling content efforts.","https://www.scalenut.com"
"MarketMuse","$149/mo","Content Planning with AI insights; Opportunity Finder for content gaps; Performance Forecasting for ROI","Uses AI to predict content success before creation.","Steep learning curve and premium pricing limit accessibility.","Best for content strategists and enterprises investing in long-term SEO.","https://www.marketmuse.com"
"Tool_Name","Price","Features","Pros","Cons","Verdict","Affiliate_Link","Description","Long_Review"
"Mangools","$49/mo","","Affordable pricing; User-friendly interface; Good for long-tail keyword research; Includes multiple tools in one suite; Daily rank tracking updates","Limited data depth compared to premium tools; Backlink analysis is basic; Not ideal for large-scale enterprises","A great budget-friendly option for small businesses and freelancers.","https://mangools.com","Affordable SEO suite with keyword research, backlink analysis, and rank tracking tools for small to medium businesses.","Mangools is a budget-friendly SEO toolset that offers a solid alternative to pricier competitors. It includes five main tools: KWFinder for keyword research, SERPChecker for analyzing search results, SERPWatcher for rank tracking, LinkMiner for backlink analysis, and SiteProfiler for competitor insights. The interface is user-friendly and intuitive, making it accessible for beginners while still providing valuable data for experienced users. KWFinder excels at finding long-tail keywords with low competition, which is great for niche targeting. SERPWatcher provides reliable tracking with daily updates, though it may lack some advanced features like historical data depth. LinkMiner offers basic backlink analysis but isn't as comprehensive as tools like Ahrefs. Overall, Mangools is a cost-effective choice for those who need essential SEO functionalities without breaking the bank. It's particularly suited for freelancers and small businesses looking to improve their organic search presence with a straightforward toolset. However, for large-scale enterprises or deep competitive analysis, its limitations in data volume and advanced metrics might be a drawback. The customer support is responsive, and the learning curve is minimal, making it a practical option for quick implementation."
"Ahrefs","$99/mo","","Extensive and accurate backlink database; Comprehensive keyword research tools; Reliable data updates; Great for competitive analysis; Integrates well with other platforms","Expensive for small users; Steep learning curve for beginners; Can be overwhelming with data","An industry-leading tool ideal for professionals and agencies.","https://ahrefs.com","Comprehensive SEO toolset known for its extensive backlink database, keyword research, and competitive analysis capabilities.","Ahrefs is widely regarded as one of the top SEO tools in the industry, particularly praised for its massive and accurate backlink database. It offers a full suite of features including Site Explorer for in-depth website analysis, Keywords Explorer for keyword research, Content Explorer for finding popular content, and Rank Tracker for monitoring search rankings. The backlink data is updated frequently and covers a vast index, making it invaluable for link-building and competitive research. Keywords Explorer provides detailed metrics like keyword difficulty, search volume, and click-through rates, with robust filtering options. The tool is highly reliable and used by many SEO professionals and agencies. However, it comes with a higher price tag, which might be prohibitive for small businesses or individuals. The interface can be complex for beginners, requiring some time to master. Despite this, Ahrefs' data accuracy and depth make it a go-to choice for serious SEO efforts. It also integrates well with other tools and offers features like content gap analysis and broken link checking. Customer support is generally good, with extensive documentation and tutorials available. For those needing top-tier data and comprehensive insights, Ahrefs is a powerful investment."
"SEMrush","$119.95/mo","","Comprehensive marketing toolkit; Excellent for competitive analysis; Includes SEO, PPC, and content tools; Regular data updates; Good for agencies and large teams","High cost; Interface can be overwhelming; Steep learning curve","A powerful all-in-one solution for integrated marketing strategies.","https://semrush.com","All-in-one marketing toolkit for SEO, PPC, content, social media, and competitive research, used by businesses of all sizes.","SEMrush is a versatile marketing platform that goes beyond SEO to include PPC, content, social media, and competitive intelligence. Its SEO toolkit features tools like Keyword Magic Tool for keyword research, Site Audit for technical SEO checks, Position Tracking for rank monitoring, and Backlink Analytics for link analysis. The platform is known for its breadth of features, making it a one-stop-shop for digital marketers. Keyword Magic Tool offers a vast database with useful filters and suggestions, while Site Audit provides detailed reports on website health. Position Tracking is customizable and supports multiple search engines. SEMrush also excels in competitive analysis, allowing users to spy on competitors' strategies across various channels. However, the pricing is on the higher side, and some users find the interface cluttered due to the multitude of tools. It requires a learning curve to utilize all features effectively. The data is generally accurate and updated regularly, with good customer support and educational resources. For businesses looking to integrate SEO with other marketing efforts, SEMrush offers great value. It's particularly beneficial for agencies and in-house teams that need a comprehensive view of their digital presence. The tool also includes features like content optimization and social media tracking, enhancing its utility."
"Ubersuggest","$29/mo","","Very affordable; User-friendly for beginners; Includes basic SEO features; Created by a well-known marketer; Regular updates and improvements","Limited data compared to premium tools; Not suitable for advanced SEO; Backlink analysis is basic","A good starter tool for SEO newcomers and small budgets.","https://neilpatel.com/ubersuggest","Affordable SEO tool created by Neil Patel, offering keyword research, site audit, and backlink data for beginners and small businesses.","Ubersuggest is a budget-friendly SEO tool developed by marketing expert Neil Patel, designed to make SEO accessible to everyone. It provides features like keyword research, site audit, backlink data, and competitor analysis. The keyword tool offers suggestions, search volume, and difficulty scores, with a focus on simplicity. Site audit checks for technical issues and provides actionable recommendations. Backlink data, while not as extensive as Ahrefs, gives a decent overview for basic analysis. Ubersuggest is easy to use, with a clean interface that's great for beginners. It's priced lower than many competitors, making it an attractive option for individuals and small businesses. However, the data depth and accuracy can be limited compared to premium tools, and it may not suffice for advanced SEO professionals. The tool is regularly updated with new features, and customer support is available. For those starting out or with limited budgets, Ubersuggest offers a solid introduction to SEO without complexity. It also includes content ideas and trend analysis, adding value for content creators. While it might not replace high-end tools for intensive campaigns, it's a practical choice for basic SEO tasks and learning."
"Moz Pro","$99/mo","","Renowned Domain Authority metric; User-friendly interface; Good for link building insights; Includes technical site audits; Strong community and resources","Higher cost for features; Data updates can be slower; Limited in some advanced areas","A trusted tool especially valuable for link building and DA tracking.","https://moz.com/products/pro","SEO software with a focus on link building, keyword research, and site audits, known for its Domain Authority metric.","Moz Pro is a well-established SEO tool that has been a staple in the industry for years, famous for its Domain Authority (DA) metric. It offers a suite of tools including Keyword Explorer for research, Site Crawl for technical audits, Link Explorer for backlink analysis, and Rank Tracker for monitoring positions. Keyword Explorer provides useful metrics like priority scores and organic click-through rates. Site Crawl is thorough in identifying issues like broken links and duplicate content. Link Explorer offers insights into link profiles with metrics like Spam Score. Moz's DA is widely used to gauge website strength, though it's proprietary and can be debated. The tool is user-friendly with a clean interface, making it accessible for various skill levels. However, it can be expensive for the features offered, and some users find the data updates slower than competitors like Ahrefs. Moz Pro is great for those who value the DA metric and prefer a tool with a strong community and educational resources. It also includes features like page optimization suggestions and local SEO tools. For businesses focused on link building and content strategy, Moz provides reliable insights. Customer support is good, with extensive help documentation."
"Surfer SEO","$59/mo","","Excellent for content optimization; Data-driven SERP analysis; User-friendly Content Editor; Integrates with popular platforms; Helps improve page rankings","Not a comprehensive SEO tool; Lacks backlink and rank tracking; Can be pricey for content-only focus","A top choice for content-focused SEO strategies.","https://surferseo.com","Content optimization tool that uses SERP analysis to provide data-driven recommendations for improving page rankings.","Surfer SEO is a specialized tool focused on content optimization by analyzing search engine results pages (SERPs) to give actionable recommendations. It helps users create content that aligns with top-ranking pages by providing metrics like keyword density, content length, and structure suggestions. The tool includes features like Content Editor for real-time optimization, Audit for existing page analysis, and Grow Flow for content planning. Content Editor is intuitive, offering a side-by-side comparison with competitors and a score to aim for. Audit tool identifies gaps in current content and suggests improvements. Surfer SEO is data-driven, reducing guesswork in content creation. It's particularly useful for SEOs and content marketers looking to boost organic traffic through optimized articles. However, it's not a full SEO suite; it lacks features like backlink analysis or rank tracking, so it's best used alongside other tools. The pricing is mid-range, making it accessible for many businesses. The interface is clean and easy to navigate, with good customer support. For those prioritizing content quality and SERP alignment, Surfer SEO is highly effective. It also integrates with platforms like Google Docs and WordPress, enhancing workflow efficiency."
"Frase","$44.99/mo","","AI-powered content generation; Saves time on research; Good for creating SEO briefs; Affordable pricing; Integrates with CMS","AI content may need editing; Not a full SEO suite; Limited to content-focused tasks","An efficient tool for AI-assisted content creation and optimization.","https://frase.io","AI-powered content research and optimization tool that helps create SEO-friendly content quickly.","Frase is an AI-driven tool designed to streamline content creation and optimization for SEO. It uses natural language processing to analyze top SERP results and generate content briefs, outlines, and optimization suggestions. Key features include Content Briefs for research, AI Writer for generating text, and Optimization for improving existing content. Content Briefs compile data from competitors, highlighting key topics and questions to address. AI Writer can produce drafts based on inputs, saving time for writers. Optimization tool provides scores and recommendations to enhance content for search engines. Frase is great for content teams and marketers looking to produce high-quality, SEO-optimized articles efficiently. It reduces research time and helps ensure content meets user intent. However, the AI-generated content may require human editing for quality, and it's not a substitute for comprehensive SEO tools like Ahrefs. The pricing is reasonable, with a user-friendly interface. Customer support is responsive, and the tool integrates with CMS platforms. For those focused on content marketing and needing to scale production, Frase offers valuable assistance. It also includes analytics to track content performance, though it's limited compared to dedicated analytics tools."
"Clearscope","$170/mo","","High accuracy in optimization; Great for enterprise teams; Includes workflow collaboration; Integrates with popular tools; Ensures content quality and SEO","Very expensive; Not suitable for small budgets; Steep learning curve","A top-tier optimization tool for large-scale content operations.","https://clearscope.io","Enterprise-grade content optimization platform that uses AI to ensure content meets SEO and readability standards.","Clearscope is a premium content optimization tool aimed at enterprises and serious content marketers. It uses AI to analyze top-ranking content and provide detailed recommendations for keywords, structure, and readability. Features include Reports for content grading, Workflow for team collaboration, and Integrations with tools like Google Docs and WordPress. Reports give a clear grade based on how well content aligns with SERP leaders, with specific suggestions for improvement. Workflow tools facilitate content review and approval processes. Clearscope is known for its accuracy and depth, making it a favorite among large organizations and agencies. It helps ensure content is not only SEO-friendly but also engaging and well-structured. However, the price is high, putting it out of reach for small businesses or individuals. The tool requires some learning to use effectively, but the interface is clean and professional. Customer support is top-notch, with dedicated account management for enterprise plans. For teams producing high volumes of content with strict quality standards, Clearscope is an excellent investment. It also offers competitor analysis and trend insights, though it's primarily focused on optimization rather than broader SEO tasks."
"Scalenut","$39/mo","","Affordable AI content tool; Combines research and creation; User-friendly interface; Good for small businesses; Regular updates","AI content needs editing; Limited broader SEO features; Analytics are basic","A cost-effective AI platform for content marketing needs.","https://scalenut.com","AI content platform that combines SEO research, content creation, and optimization for marketers and businesses.","Scalenut is an AI-powered content platform that offers a blend of SEO research, content creation, and optimization tools. It includes features like Topic Research for finding content ideas, AI Writer for generating drafts, and SEO Optimizer for improving content. Topic Research uses AI to analyze trends and suggest relevant topics. AI Writer can produce articles based on briefs, with options for tone and style. SEO Optimizer provides recommendations to enhance search engine performance. Scalenut is designed to be an all-in-one solution for content marketing, making it efficient for teams and individuals. It's priced affordably, appealing to small businesses and freelancers. The interface is intuitive, with templates and guides to help users get started. However, as with many AI tools, the generated content may require human refinement for originality and depth. It's not as comprehensive as tools like SEMrush for broader SEO tasks. Customer support is available, and the tool is regularly updated with new features. For those looking to streamline content production with AI assistance, Scalenut offers good value. It also includes analytics to track content performance, though it's basic compared to dedicated analytics platforms."
"MarketMuse","$149/mo","","Excellent for content strategy; AI-driven topic analysis; Helps create comprehensive content; Good for enterprises; Includes competitor insights","High cost; Complex for beginners; Not a complete SEO tool","A strategic tool for in-depth content planning and optimization.","https://marketmuse.com","AI-driven content strategy and optimization platform that helps plan and create comprehensive, topic-focused content.","MarketMuse is an advanced AI platform focused on content strategy and optimization, helping users plan, create, and improve content based on topic depth and relevance. It offers features like Content Inventory for auditing existing content, Research for topic analysis, and Optimize for enhancing articles. Content Inventory identifies gaps and opportunities in a content library. Research tool uses AI to map out topic clusters and suggest coverage areas. Optimize provides scores and recommendations to align content with top competitors. MarketMuse is known for its depth in content planning, making it ideal for enterprises and content strategists. It helps ensure content is comprehensive and authoritative, which can boost SEO performance. However, the pricing is high, and it requires a significant time investment to master. The tool is not a full SEO suite; it's best used alongside other tools for tasks like backlink analysis. The interface is professional but can be complex for beginners. Customer support is good, with training resources available. For organizations serious about content-driven SEO, MarketMuse offers powerful insights. It also includes competitor analysis and performance tracking, though these are secondary to its core optimization focus."
"Tool_Name","Price","Features","Pros","Cons","Verdict","Affiliate_Link","Description","Long_Review"
"Mangools","$49/mo","","Affordable pricing; Easy-to-use interface; Good for keyword and backlink analysis","Limited data coverage; Fewer advanced features","Best for budget-conscious users needing essential SEO tools.","https://mangools.com","Affordable SEO toolset with keyword research, backlink analysis, and rank tracking features for small to medium businesses.","Mangools is a budget-friendly SEO suite that offers a solid set of features for users looking to optimize their websites without breaking the bank. It includes tools like KWFinder for keyword research, SERPChecker for analyzing search results, and LinkMiner for backlink analysis. The interface is user-friendly and intuitive, making it accessible for beginners while still providing enough depth for more experienced SEO professionals. However, its data coverage can be limited compared to premium tools, and advanced features like content optimization are less robust. Overall, Mangools is a great choice for those on a tight budget who need reliable basic SEO functionalities."
"Ahrefs","$99/mo","","Extensive backlink database; Accurate data; Great for competitive analysis","High cost; Steep learning curve","Ideal for professionals and agencies requiring deep SEO insights.","https://ahrefs.com","Comprehensive SEO tool known for its extensive backlink database, keyword research, and competitive analysis capabilities.","Ahrefs is widely regarded as one of the top SEO tools in the industry, particularly praised for its massive and accurate backlink database. It offers features like Site Explorer for in-depth website analysis, Keywords Explorer for detailed keyword research, and Content Explorer for finding popular content. The tool is highly reliable and provides deep insights into competitor strategies, making it a favorite among SEO experts. On the downside, it can be expensive for small businesses, and the interface might have a steeper learning curve for beginners. Despite this, Ahrefs' robust data and comprehensive features make it a powerful asset for serious SEO efforts."
"SEMrush","$119.95/mo","","Comprehensive marketing tools; Accurate SEO data; Good for multi-channel strategies","Expensive; Can be overwhelming for beginners","Excellent for marketers needing an all-in-one digital toolkit.","https://semrush.com","All-in-one marketing toolkit with SEO, PPC, content, and social media tools for comprehensive digital strategy.","SEMrush is a versatile marketing platform that goes beyond SEO to include PPC, content marketing, and social media management. Its SEO features are top-notch, with tools for keyword research, site audits, and position tracking. The platform is known for its extensive database and accurate metrics, helping users optimize their online presence across multiple channels. However, the pricing can be high for solo entrepreneurs, and the plethora of features might overwhelm new users. SEMrush is best suited for marketers and businesses looking for an integrated solution to manage various aspects of their digital marketing campaigns effectively."
"Ubersuggest","$29/mo","","Affordable; Easy to use; Good for beginners","Limited data accuracy; Fewer advanced features","Perfect for entry-level users seeking basic SEO insights.","https://neilpatel.com/ubersuggest","User-friendly SEO tool by Neil Patel offering keyword ideas, site audits, and backlink data at an affordable price.","Ubersuggest is a cost-effective SEO tool developed by Neil Patel, designed to simplify keyword research and site analysis for users of all skill levels. It provides features like keyword suggestions, competitor analysis, and site audits, all wrapped in an easy-to-navigate interface. The tool is great for generating content ideas and identifying SEO opportunities without a hefty price tag. However, its data depth and accuracy may not match premium tools like Ahrefs or SEMrush, and it lacks some advanced functionalities. Ubersuggest is a solid option for beginners and small businesses looking to dip their toes into SEO without significant investment."
"Moz Pro","$99/mo","","User-friendly interface; Reliable metrics; Good for technical SEO","Higher cost; Less data depth than some rivals","Suitable for users valuing simplicity and trusted SEO metrics.","https://moz.com/products/pro","SEO software with tools for keyword research, link building, site audits, and rank tracking, known for its user-friendly approach.","Moz Pro is a well-established SEO tool that emphasizes ease of use and reliable data. It offers features like Keyword Explorer for research, Link Explorer for backlink analysis, and Site Crawl for technical audits. Moz is particularly known for its Domain Authority metric, which helps gauge website strength. The tool is great for those who prefer a straightforward interface and actionable insights. However, it can be pricey compared to some competitors, and its data might not be as extensive as tools like Ahrefs. Moz Pro is a trusted choice for SEO professionals and businesses looking for a balanced mix of usability and functionality."
